<?xml version="1.0" encoding="UTF-8"?>
<CredentialStructure xmlns="http://www.zurich.ibm.com/security/idemix/credentialStructure"
	xmlns:xsi="http://www.w3.org/2001/XMLSchema-instance" xmlns:xs="http://www.w3.org/2001/XMLSchema"
	xsi:schemaLocation="http://www.zurich.ibm.com/security/idemix/credentialStructure ../xsd/CredentialStructure.xsd">

	<Attributes>
		<Attribute issuanceMode="known" name="FirstName" type="string" />
		<Attribute issuanceMode="known" name="LastName" type="string" />
		<Attribute issuanceMode="known" name="CivilStatus" type="enum">
			<EnumValue>Marriage</EnumValue>
			<EnumValue>NeverMarried</EnumValue>
			<EnumValue>Widowed</EnumValue>
			<EnumValue>LegallySeparated</EnumValue>
			<EnumValue>AnnulledMarriage</EnumValue>
			<EnumValue>Divorced</EnumValue>
			<EnumValue>Common-lawPartner</EnumValue>
		</Attribute>
		<Attribute issuanceMode="known" name="SocialSecurityNumber"
			type="int" />
		<Attribute issuanceMode="known" name="BirthDate" type="int" />
		<Attribute issuanceMode="committed" name="Diet" type="string" />
		<Attribute issuanceMode="known" name="Epoch" type="epoch" />
		<Attribute issuanceMode="known" name="OfficialLanguage"
			type="enum">
			<EnumValue>German</EnumValue>
			<EnumValue>French</EnumValue>
			<EnumValue>Italian</EnumValue>
			<EnumValue>Rhaeto-Romanic</EnumValue>
		</Attribute>
		<Attribute issuanceMode="committed" name="DriverCategory"
			type="enum">
			<EnumValue>A1</EnumValue>
			<EnumValue>B</EnumValue>
			<EnumValue>B1</EnumValue>
			<EnumValue>C</EnumValue>
			<EnumValue>C1</EnumValue>
			<EnumValue>D</EnumValue>
			<EnumValue>D1</EnumValue>
			<EnumValue>BE</EnumValue>
			<EnumValue>CE</EnumValue>
			<EnumValue>DE</EnumValue>
			<EnumValue>C1E</EnumValue>
			<EnumValue>D1E</EnumValue>
			<EnumValue>F</EnumValue>
			<EnumValue>G</EnumValue>
			<EnumValue>M</EnumValue>
		</Attribute>
		<Attribute issuanceMode="known" name="Gender" type="enum">
			<EnumValue>Male</EnumValue>
			<EnumValue>Female</EnumValue>
		</Attribute>
	</Attributes>

	<Features>
		<UpdateSpecification>http://www.ch.ch/identityCard/v2012/updateSpecification_CredStructComplete.xml
		</UpdateSpecification>
	</Features>

	<Implementation>
		<PrimeEncoding name="PrimeEncoding1" numValues="15">
			<PrimeFactor attName="CivilStatus" attValue="Marriage">3
			</PrimeFactor>
			<PrimeFactor attName="CivilStatus" attValue="NeverMarried">5
			</PrimeFactor>
			<PrimeFactor attName="CivilStatus" attValue="Widowed">7
			</PrimeFactor>
			<PrimeFactor attName="CivilStatus" attValue="LegallySeparated">11
			</PrimeFactor>
			<PrimeFactor attName="CivilStatus" attValue="AnnulledMarriage">13
			</PrimeFactor>
			<PrimeFactor attName="CivilStatus" attValue="Divorced">17
			</PrimeFactor>
			<PrimeFactor attName="CivilStatus" attValue="Common-lawPartner">19
			</PrimeFactor>
			<PrimeFactor attName="OfficialLanguage" attValue="German">23
			</PrimeFactor>
			<PrimeFactor attName="OfficialLanguage" attValue="French">29
			</PrimeFactor>
			<PrimeFactor attName="OfficialLanguage" attValue="Italian">31
			</PrimeFactor>
			<PrimeFactor attName="OfficialLanguage" attValue="Rhaeto-Romanic">37
			</PrimeFactor>
			<PrimeFactor attName="Gender" attValue="Male">41
			</PrimeFactor>
			<PrimeFactor attName="Gender" attValue="Female">43
			</PrimeFactor>
		</PrimeEncoding>
		<PrimeEncoding name="PrimeEncoding2" numValues="15">
			<PrimeFactor attName="DriverCategory" attValue="A1">3
			</PrimeFactor>
			<PrimeFactor attName="DriverCategory" attValue="B">5
			</PrimeFactor>
			<PrimeFactor attName="DriverCategory" attValue="B1">7
			</PrimeFactor>
			<PrimeFactor attName="DriverCategory" attValue="C">11
			</PrimeFactor>
			<PrimeFactor attName="DriverCategory" attValue="C1">13
			</PrimeFactor>
			<PrimeFactor attName="DriverCategory" attValue="D">17
			</PrimeFactor>
			<PrimeFactor attName="DriverCategory" attValue="D1">19
			</PrimeFactor>
			<PrimeFactor attName="DriverCategory" attValue="BE">23
			</PrimeFactor>
			<PrimeFactor attName="DriverCategory" attValue="CE">29
			</PrimeFactor>
			<PrimeFactor attName="DriverCategory" attValue="DE">31
			</PrimeFactor>
			<PrimeFactor attName="DriverCategory" attValue="C1E">37
			</PrimeFactor>
			<PrimeFactor attName="DriverCategory" attValue="D1E">41
			</PrimeFactor>
			<PrimeFactor attName="DriverCategory" attValue="F">43
			</PrimeFactor>
			<PrimeFactor attName="DriverCategory" attValue="G">47
			</PrimeFactor>
			<PrimeFactor attName="DriverCategory" attValue="M">53
			</PrimeFactor>
		</PrimeEncoding>
		<AttributeOrder>
			<Attribute name="FirstName">1</Attribute>
			<Attribute name="LastName">2</Attribute>
			<Attribute name="PrimeEncoding1">3</Attribute>
			<Attribute name="SocialSecurityNumber">4</Attribute>
			<Attribute name="BirthDate">5</Attribute>
			<Attribute name="Diet">6</Attribute>
			<Attribute name="Epoch">7</Attribute>
			<Attribute name="PrimeEncoding2">8</Attribute>
		</AttributeOrder>
	</Implementation>

</CredentialStructure>